{
    "$schema": "https://clicksounds.github.io/clicks/pack.schema.json",
    "id": "andarian.andarians-g502-hero",
    "packgen": true,
    "type": "Useful",
    "name": "Andarians G502 Hero",
    "description": "remake and (hopefully) better optimized version of my (old/unreleased/deleted) G502 Hero clickpack! clicks all made by @andarianwx on mobile.",
    "authors": [
        {
            "name": "Andarian",
            "gdAccountID": 27823067
        }
    ]
}
